{
  "account_id": "123456789012",
  "assume_role": {
    "external_id": "dndn-extid-example",
    "role_arn": "arn:aws:iam::123456789012:role/DnDnCollectorReadRole"
  },
  "event_time": "2026-02-26T18:00:00+09:00",
  "hint": {
    "resource": {
      "region": "ap-northeast-2",
      "resource_id": "sg-0abc123def456",
      "resource_type": "AWS::EC2::SecurityGroup"
    }
  },
  "regions": [
    "ap-northeast-2"
  ],
  "rule_set_version": "eks-mvp-0.1",
  "run_id": "01J0SHULID9999",
  "s3": {
    "bucket": "dndn-data",
    "prefix": "account_id=123456789012/type=EVENT/year=2026/month=02/day=26/run_id=01J0SHULID9999"
  },
  "trigger": {
    "finding_arn": "arn:aws:securityhub:ap-northeast-2:123456789012:security-control/EC2.19/finding/abc123",
    "raw_event_s3_uri": "s3://dndn-data/account_id=123456789012/type=EVENT/year=2026/month=02/day=26/run_id=01J0SHULID9999/raw/trigger/securityhub_finding.json",
    "severity": "CRITICAL",
    "source": "SECURITYHUB"
  },
  "type": "EVENT",
  "window_minutes": 60
}